name,ingredients,diet,prep_time,cook_time,flavor_profile,course,state,region,instructions
Sandesh,"Milk, sugar, saffron, cardamom",vegetarian,30,20,sweet,dessert,West Bengal,East,"Sandesh is a delightful Bengali sweet made with milk, sugar, saffron, and cardamom. To prepare Sandesh, milk is curdled to obtain chhena (fresh paneer or cottage cheese). The chhena is then kneaded until it reaches a smooth and creamy consistency. Sugar is added to sweeten the chhena mixture, and saffron is often used for color and a hint of flavor. Some recipes also include cardamom for additional aromatic notes. The sweetened chhena mixture is then shaped into small, flattened rounds or other desired forms. Sandesh is a light and flavorful sweet, loved for its delicate texture and the combination of saffron and cardamom that gives it a distinct taste."
Adhirasam,"Rice flour, jaggery, ghee, vegetable oil, elachi",vegetarian,10,50,sweet,dessert,West Bengal,East,"Adhirasam is a traditional South Indian sweet made with rice flour, jaggery, ghee, vegetable oil, and elachi (cardamom). To prepare Adhirasam, rice flour is mixed with powdered jaggery, ghee, and cardamom to form a smooth, thick batter. This batter is then shaped into small, flat rounds or patties. These patties are deep-fried in vegetable oil until they turn golden brown, resulting in a crispy outer layer and a soft inner texture. Adhirasam is a popular treat, often made during festivals and special occasions in South India. Its unique combination of ingredients gives it a distinct flavor that is both sweet and aromatic."
Ariselu,"Rice flour, jaggery, ghee",vegetarian,15,75,sweet,dessert,Andhra Pradesh,South,"Ariselu is a traditional South Indian sweet made with a simple combination of rice flour, jaggery, and ghee. To prepare Ariselu, rice flour is mixed with jaggery syrup, which is made by melting jaggery in water and then straining to remove impurities. Ghee is added to the rice flour and jaggery mixture, and the dough is kneaded to achieve a smooth consistency. Small portions of the dough are then shaped into flat, round patties and deep-fried until they turn golden brown. The result is a sweet delicacy with a crispy exterior and a chewy, flavorful interior. Ariselu is often prepared during festivals and special occasions in South India."
Bandar laddu,"Besan, jaggery, cardamom powder, ghee, cashews and raisins, jaggery syrup, sugar",vegetarian,5,35,sweet,dessert,Andhra Pradesh,South,"Bandar Laddu is a traditional Andhra sweet that is made with besan (gram flour), jaggery, cardamom powder, ghee, cashews, raisins, jaggery syrup, and sugar. To prepare Bandar Laddu, besan is roasted in ghee until it turns golden brown and aromatic. Jaggery syrup is prepared separately by dissolving jaggery in water, and this syrup is then added to the roasted besan along with cardamom powder. The mixture is stirred well to ensure a smooth consistency. Finally, cashews and raisins are added for crunch and texture. The sweetened besan mixture is shaped into round laddus (sweet balls). Bandar Laddu is known for its rich and nutty flavor, making it a popular treat during festivals and celebrations in Andhra Pradesh, India."
Chikki,"Peanuts, jaggery",vegetarian,10,20,sweet,dessert,Maharashtra,West,"Chikki is a popular Indian sweet snack made with just two main ingredients: peanuts and jaggery. To prepare Chikki, peanuts are roasted until they become crunchy and aromatic. In a separate pan, jaggery is melted to form a syrup. The roasted peanuts are then mixed into the jaggery syrup until well-coated. The mixture is quickly spread on a flat surface and flattened to cool and harden. Once set, the Chikki is broken into pieces, creating sweet and nutty bars or clusters. This classic treat is enjoyed for its combination of the natural sweetness of jaggery and the crunchiness of roasted peanuts, making it a favorite during festivals and as a quick energy snack."
Dharwad pedha,"Milk, Sugar, Dharwadi buffalo milk",vegetarian,20,60,sweet,dessert,Karnataka,South,"Dharwad Peda is a traditional Indian sweet that hails from the city of Dharwad in Karnataka. It is made with a few simple ingredients, including milk, sugar, and Dharwadi buffalo milk, which is known for its unique flavor and richness. To prepare Dharwad Peda, milk is reduced and thickened to form khoya (reduced milk solids). This khoya is then mixed with sugar to sweeten the mixture. The use of Dharwadi buffalo milk is said to contribute to the distinct taste of Dharwad Peda. The mixture is cooked until it reaches a fudgy consistency, and the pedas are shaped into small, round discs. Dharwad Peda is enjoyed for its rich and creamy texture, making it a beloved sweet in Karnataka cuisine."
Double ka meetha,"Loaf bread, milk",vegetarian,20,30,sweet,dessert,Telangana,South,"Double ka Meetha is a luscious Indian dessert that transforms simple ingredients into a delightful sweet treat. Slices of loaf bread are toasted or fried until golden and crispy. Meanwhile, a sweet and aromatic milk syrup is prepared by simmering milk with sugar and flavored with cardamom. The toasted bread slices are then immersed in this decadent milk mixture, allowing them to absorb the rich flavors. The result is a heavenly fusion of crispy bread and sweetened milk, garnished with chopped nuts for added crunch. Double ka Meetha is a beloved dessert, cherished for its simplicity and indulgent taste, making it a favorite during celebrations and festive occasions in Indian cuisine."
Gavvalu,"Rice flour, sugar, salt, ghee, semolina",vegetarian,10,30,sweet,dessert,Andhra Pradesh,South,"Gavvalu is a traditional South Indian snack that combines the simplicity of ingredients with delightful taste. To make Gavvalu, a dough is prepared by mixing rice flour, sugar, a pinch of salt, ghee (clarified butter), and semolina. The ingredients are combined to form a smooth, pliable dough. Small portions of the dough are then shaped into small, shell-like structures resembling cowrie shells, giving the snack its distinctive appearance. These dough shapes are deep-fried until they turn golden brown, resulting in crispy and crunchy Gavvalu. Often enjoyed during festivals and special occasions, Gavvalu showcases the harmonious blend of sweet and savory notes, making it a beloved treat in South Indian cuisine."
Kakinada khaja,"Wheat flour, sugar",vegetarian,10,30,sweet,dessert,Andhra Pradesh,South,"Kakinada Khaja is a traditional sweet delicacy from the coastal town of Kakinada in Andhra Pradesh, India. The sweet is crafted with a simple yet delightful combination of wheat flour and sugar. To prepare Kakinada Khaja, wheat flour is kneaded into a smooth dough and rolled into thin sheets. These sheets are then layered with sugar and folded, creating multiple layers. The layered dough is then rolled out and cut into small, square-shaped pieces. Finally, these pieces are deep-fried until they attain a golden brown color, resulting in crispy, flaky Khajas with a sweet and melt-in-the-mouth texture. Kakinada Khaja is often enjoyed during festivals and celebrations, showcasing the culinary heritage of Andhra Pradesh."
Mysore pak,"Besan flour, semolina, mung bean, jaggery, coconut, skimmed milk powder, sugar, ghee",vegetarian,5,20,sweet,dessert,Karnataka,South,"The key ingredients in this delectable treat include besan flour (gram flour) and semolina, which form the base, lending a distinctive texture. Mung bean flour adds a nutty undertone, while jaggery and sugar contribute sweetness. Ghee, a clarified butter, is generously used, imparting a buttery richness to the dessert. Additionally, coconut and skimmed milk powder enhance the overall creaminess. The preparation involves skillfully combining these ingredients into a smooth, thick batter before it is set and cut into pieces. The result is a mouthwatering Mysore Pak, with its melt-in-the-mouth consistency and a harmonious blend of flavors that celebrate the essence of Indian sweets."
Obbattu holige,"Maida flour, turmeric, coconut, chickpeas, jaggery, ghee, cardamom",vegetarian,180,60,sweet,main course,Karnataka,South,"Obbattu Holige, also known simply as Holige, is a traditional South Indian sweet flatbread that boasts a delightful combination of flavors. The main ingredients include Maida flour, a fine wheat flour that forms the dough, and turmeric, which imparts a golden hue to the outer layer. The sweet filling consists of a mixture of grated coconut, cooked chickpeas, jaggery for sweetness, and ghee for richness. The addition of cardamom enhances the overall aromatic profile of the filling. The dough is carefully rolled out, filled with this sweet mixture, and then folded to create thin, delicious flatbreads. Once cooked on a griddle, the Obbattu Holige is ready to be enjoyed, offering a perfect balance of textures and a symphony of flavors that showcase the unique culinary heritage of South India."
Palathalikalu,"Rice flour, milk",vegetarian,10,25,sweet,dessert,Andhra Pradesh,South,"Palathalikalu is a traditional South Indian dish, particularly popular in Andhra Pradesh, that consists of minimal yet essential ingredients. The primary components are rice flour and milk. The rice flour is meticulously prepared into a smooth dough, and small, intricate pasta-like shapes are handcrafted from it. These delicate rice flour dumplings are then cooked in milk, infusing them with a rich and creamy flavor. The simplicity of the ingredients allows the natural taste of rice to shine through while the milk adds a luscious and comforting element. Palathalikalu is often served as a dessert or a special treat during festive occasions, showcasing the artistry of traditional South Indian cuisine."
Poornalu,"Chana dal, jaggery",vegetarian,240,60,sweet,dessert,Andhra Pradesh,South,"Poornalu, a cherished sweet from Andhra Pradesh, features a delectable filling made with chana dal and jaggery. The process begins by cooking chana dal until it achieves a soft texture, and then it's combined with jaggery, a natural sweetener with a rich, caramel-like flavor. The duo is simmered until it forms a thick, cohesive mixture. This sweet and nutty filling is then encased in a dough made from rice flour or a combination of rice flour and urad dal. The filled dough balls are carefully shaped and deep-fried to a golden brown perfection. Poornalu are not only a delightful treat during festive occasions but also a testament to the culinary artistry that combines the earthy taste of chana dal with the natural sweetness of jaggery."
Pongal,"Rice, jaggery, cashews, ghee",vegetarian,5,20,sweet,dessert,Tamil Nadu,South,"Pongal is a traditional South Indian dish that can be either a savory or sweet preparation. In the sweet version, one of the key ingredients is rice, which is cooked until it reaches a creamy consistency. Jaggery, a natural sweetener made from concentrated sugarcane juice, is then added to sweeten the dish, providing a rich, earthy sweetness. The inclusion of cashews adds a delightful crunch and nutty flavor, while ghee, or clarified butter, contributes a rich and aromatic touch to the overall preparation. Pongal is often enjoyed as a festive sweet dish during celebrations such as the harvest festival of Pongal in South India, highlighting the region's love for combining simple yet flavorful ingredients in its culinary traditions."
Pootharekulu,"Rice flour, powdered sugar, ghee",vegetarian,10,60,sweet,dessert,Andhra Pradesh,South,"Pootharekulu is a traditional Andhra sweet delicacy known for its delicate layers and sweet filling. The main ingredients in its preparation include rice flour, powdered sugar, and ghee. The rice flour is meticulously crafted into thin, transparent sheets, creating the delicate layers that give Pootharekulu its unique texture. These sheets are then filled with a sweet mixture made from powdered sugar and ghee, resulting in a luscious, sugary filling. The layers are carefully folded to create a cylindrical or conical shape, showcasing the artisanal skill involved in making this treat. Pootharekulu is often enjoyed during festivals and special occasions, and its delightful combination of crispy layers and sweet filling makes it a beloved treat in Andhra Pradesh's culinary tradition."
Qubani ka meetha,"Apricots, sugar syrup",vegetarian,10,20,sweet,dessert,Telangana,South,"Qubani ka Meetha, a cherished dessert hailing from Hyderabad, is prepared with the simplest yet flavorful ingredients—dried apricots and sugar syrup. The process begins by soaking the dried apricots until they attain a soft, luscious texture. Subsequently, these apricots are stewed in a sugar syrup until the mixture transforms into a decadent, rich consistency. The sugar syrup not only sweetens the apricots but also coats them in a glossy, sweet glaze. The final creation, Qubani ka Meetha, showcases the natural sweetness of apricots complemented by the sugary infusion, offering a delightful dessert that is often adorned with almonds or nuts for added texture. This dessert is a testament to the art of combining a few high-quality ingredients to create a sublime and traditional Indian sweet."
Sheer korma,"Vermicelli pudding, milk",vegetarian,10,20,sweet,dessert,Telangana,South,"Sheer Korma is a delightful vermicelli pudding with roots in Persian and Mughlai cuisine, commonly prepared during festive occasions, especially Eid. The preparation involves cooking fine vermicelli in ghee until it turns golden brown, imparting a rich flavor. It is then simmered in milk until the vermicelli is tender and has absorbed the milk's richness. The key to Sheer Korma's distinct taste lies in the addition of dates, nuts, and cardamom, which infuse the dish with sweetness, crunch, and aromatic warmth. This creamy and fragrant dessert is a cherished part of celebratory feasts, celebrated for its comforting texture and exquisite blend of flavors."
Shankarpali,"Sugar, ghee, maida flour, semolina",vegetarian,10,35,sweet,dessert,Maharashtra,West,"To prepare Shankarpali, the ingredients are mixed to form a smooth dough, which is then rolled out and cut into small, diamond-shaped pieces. These pieces are deep-fried until they become crisp and golden brown. Shankarpali is known for its sweet and buttery flavor, making it a delightful treat enjoyed during festivals and celebrations across India. The combination of maida flour and semolina gives it a unique texture, and the sweetness adds a perfect balance to the richness of ghee."
Shrikhand,"Curd, sugar, saffron, cardamom",vegetarian,10,720,sweet,dessert,Maharashtra,West,"Shrikhand is a popular Indian dessert made from strained yogurt (curd), sugar, saffron, and cardamom. To prepare Shrikhand, yogurt is hung or strained to remove excess whey, resulting in a thick and creamy consistency. Sugar is added to sweeten the yogurt, and saffron is often infused to impart a rich golden color and a subtle floral aroma. Additionally, cardamom is incorporated for its aromatic warmth. The ingredients are mixed thoroughly to create a smooth and flavorful dessert. Shrikhand is served chilled and is enjoyed for its sweet, tangy, and aromatic profile, making it a favorite during festive occasions and celebrations."
Sutar feni,"Maida, sugar, ghee",vegetarian,15,55,sweet,dessert,Maharashtra,West,"Sutar Feni is a traditional Indian sweet made with a mixture of maida (all-purpose flour), sugar, and ghee. To prepare it, the ingredients are combined to form a dough, which is then rolled out and cut into thin strips or threads. These strips are deep-fried until they become golden brown and crispy. The fried feni is then coated with sugar syrup, giving it a sweet and glossy finish. Sutar Feni is known for its delicate, flaky texture and sweet taste, making it a popular treat, especially during festive occasions and celebrations. The use of maida, sugar, and ghee contributes to its unique and indulgent flavor."
Maach Jhol,"Fish, potol, tomato, chillies, ginger, garlic",non vegetarian,10,40,spicy,main course,Assam,North East,"Maach Jhol is a traditional Bengali fish curry known for its flavorful and aromatic broth. To prepare Maach Jhol, fish is cooked with potol (pointed gourd), tomatoes, green chillies, ginger, and garlic. The ingredients are simmered in a broth until the fish is cooked through and the flavors meld together. The curry is seasoned with spices, such as turmeric and cumin, to enhance its taste. Maach Jhol showcases the rich culinary heritage of Bengal, with its emphasis on fresh ingredients and aromatic spices, creating a delicious and comforting fish curry."
Pork Bharta,"Boiled pork, onions, chillies, ginger and garlic",non vegetarian,-1,-1,spicy,main course,Tripura,North East,"Pork Bharta is a flavorful Indian dish made with boiled pork, onions, chillies, ginger, and garlic. To prepare, boiled pork is shredded or minced and then sautéed with finely chopped onions, green chillies, and a mix of ginger and garlic for a robust flavor. The dish is seasoned with various spices to enhance its taste, and it is often cooked until the pork becomes tender and absorbs the aromatic spices. Pork Bharta is a delicious and spicy preparation, showcasing the rich and diverse flavors of Indian cuisine, especially popular in regions that embrace pork as a staple meat."
Chak Hao Kheer,"Rice, milk, sugar, cardamom",vegetarian,240,45,sweet,dessert,Manipur,North East,"Chak Hao Kheer is a traditional Manipuri rice pudding made with a simple combination of rice, milk, sugar, and cardamom. To prepare, rice is cooked in milk until it achieves a creamy consistency. Sugar is added for sweetness, and cardamom is incorporated for aromatic flavor. The kheer is simmered until the rice is soft and the flavors meld together, creating a comforting and fragrant rice pudding. Chak Hao Kheer is often enjoyed as a sweet treat, especially during festivals and special occasions in Manipur, showcasing the simplicity and richness of regional cuisine."
Galho,"Rice, axone, salt, water, chillies, pork",non vegetarian,5,15,spicy,main course,Nagaland,North East,"Galho is a traditional Naga dish made with a combination of rice, axone (fermented soybean), salt, water, chillies, and pork. To prepare Galho, rice is cooked along with axone, salt, and water to form a soupy base. The dish is then flavored with chillies for heat and pork for additional savory richness. The ingredients are simmered together until the rice is cooked and the flavors are well-infused, resulting in a hearty and flavorful rice soup. Galho is a staple in Naga cuisine, reflecting the region's reliance on locally available ingredients and showcasing its unique culinary traditions."
Aloo gobi,"Cauliflower, potato, garam masala, turmeric, curry leaves",vegetarian,10,20,spicy,main course,Punjab,North,"Aloo Gobi is a classic North Indian dish made with cauliflower (gobi) and potatoes (aloo), seasoned with garam masala, turmeric, and curry leaves. To prepare, cauliflower and potatoes are sautéed with aromatic spices such as garam masala and turmeric, imparting a warm and flavorful profile. Curry leaves add an additional layer of aroma and taste. The dish is cooked until the vegetables are tender and infused with the rich blend of spices. Aloo Gobi is a popular vegetarian dish, enjoyed for its simplicity, hearty flavors, and the perfect balance of spices."
Aloo matar,"Potato, peas, chillies, ginger, garam masala, garlic",vegetarian,5,40,spicy,main course,Punjab,North,"Aloo Methi is a simple and flavorful Indian dish made with potatoes (aloo) and fresh fenugreek leaves (methi). To prepare, potatoes are diced and cooked with fenugreek leaves, green chillies, and salt. The dish is typically sautéed in oil until the potatoes are tender and infused with the aromatic flavor of fenugreek. Aloo Methi is appreciated for its earthy taste and the distinct bitterness of fenugreek leaves, creating a delicious and wholesome vegetarian side dish commonly enjoyed with Indian bread or rice."
Bhatura,"Chole, rava, yogurt, plain flour, baking soda",vegetarian,20,20,spicy,main course,Punjab,North,"Bhatura is a popular Indian fried bread that is often served with Chole (chickpea curry). To prepare Bhatura, a dough is made using a mixture of plain flour, rava (semolina), yogurt, and a pinch of baking soda. The ingredients are kneaded together to form a smooth and elastic dough, which is then allowed to rest. Small portions of the dough are rolled into flat discs and deep-fried until they puff up and turn golden brown. Bhatura is known for its soft and fluffy texture, making it an ideal accompaniment to the flavorful and spicy Chole."
Bhindi masala,"Ladies finger, garam masala, kasuri methi, tomatoes, chili powder",vegetarian,20,30,spicy,main course,Punjab,North,"Bhindi Masala is a flavorful Indian dish made with ladies finger (bhindi), tomatoes, and a blend of aromatic spices. To prepare, wash and chop the bhindi, sauté it until partially cooked in a pan with oil. Add finely chopped tomatoes and continue cooking until the bhindi is tender. Season with garam masala, kasuri methi, red chili powder, and salt, ensuring even distribution of the spices. Cook until the bhindi is well coated, and the flavors meld together. This dish offers a delightful combination of textures and tastes, making it a perfect accompaniment to Indian bread or rice."
Biryani,"Chicken thighs, basmati rice, star anise, sweet, green chillies",non vegetarian,30,120,spicy,main course,Telangana,South,"To prepare Chicken Biryani, start by marinating chicken thighs with a blend of aromatic spices. Rinse and soak basmati rice. In a pot, layer marinated chicken thighs with partially cooked rice, adding star anise for a subtle fragrance. Introduce elements of sweetness, such as caramelized onions or raisins, for depth. Embed green chillies for a touch of heat. Seal the pot and let the biryani cook on low heat, allowing the flavors to intermingle and the rice to absorb the essence of the spiced chicken. The result is a fragrant and flavorful one-pot dish that captures the essence of traditional Indian cuisine. Serve hot and garnish with fresh herbs for a delightful culinary experience."
Butter chicken,"Chicken, greek yogurt, cream, garam masala powder, cashew nuts, butter",non vegetarian,10,35,spicy,main course,NCT of Delhi,North,"Butter Chicken, a classic Indian dish, is prepared by marinating tender chicken pieces in a mixture of Greek yogurt, cream, and a blend of spices, including garam masala powder. The marinade infuses the chicken with rich flavors and ensures a succulent texture. A key element is the addition of cashew nuts, which contribute to the dish's creamy and nutty profile. During cooking, generous amounts of butter are used, enhancing the dish's indulgent and velvety consistency. The result is a luscious, mildly spiced chicken curry with a velvety texture, making Butter Chicken a beloved and comforting dish in Indian cuisine. Serve it with naan or rice for a delightful culinary experience."
Chana masala,"Chickpeas, tomato paste, garam masala, ginger, red onion, avocado oil",vegetarian,20,30,spicy,main course,Punjab,North,"Chana Masala, a popular Indian dish, is crafted by simmering chickpeas in a fragrant blend of spices. Begin by sautéing red onion and ginger in avocado oil until aromatic. Introduce tomato paste, allowing it to cook down and create a flavorful base. The heart of the dish lies in the addition of garam masala, which imparts a warm and complex spice profile. The chickpeas are then added to the mix, absorbing the rich flavors during simmering. The result is a hearty and protein-packed curry with a robust combination of spices. Chana masala is a versatile dish, enjoyed with rice, naan, or bread, making it a wholesome and satisfying choice for vegetarians and non-vegetarians alike."
Chapati,"Whole wheat flour, olive oil, hot water, all purpose flour",vegetarian,10,10,-1,main course,Maharashtra,West,"Chapati, a staple in Indian cuisine, is made by combining whole wheat flour with olive oil and hot water to form a soft and pliable dough. The use of whole wheat flour adds nutritional value to the flatbread. A touch of olive oil enhances the texture and imparts a subtle flavor. The dough is then kneaded until smooth and divided into small portions. Each portion is rolled out into a thin, round disc and cooked on a hot griddle. The addition of a small amount of all-purpose flour during rolling helps achieve the desired consistency. Chapatis are quick to make and serve as a versatile accompaniment to various dishes, providing a wholesome and delicious element to meals."
Chicken razala,"Chicken, dahi, sesame seeds, garam masala powder, cashew nuts, saffron",non vegetarian,10,35,spicy,main course,West Bengal,East,"Chicken Razala is a delectable Indian dish known for its rich and aromatic flavors. The recipe involves marinating chicken in a mixture of dahi (yogurt), garam masala powder, and a blend of spices for a tender and flavorful base. The distinctive character of Chicken Razala comes from the addition of sesame seeds, which contribute a nutty undertone, and cashew nuts, which lend creaminess to the dish. Saffron is introduced to infuse a subtle and luxurious aroma. The marinated chicken is then slow-cooked to perfection, allowing the flavors to meld and create a mouthwatering curry. Chicken Razala is a delightful choice for those seeking a harmonious blend of spices and textures, making it a standout dish in Indian cuisine. Serve it with rice or naan for a complete and satisfying meal."
