name,ingredients,diet,prep_time,cook_time,flavor_profile,course,state,region,instructions
Balu shahi,"Maida flour, yogurt, oil, sugar",vegetarian,45,25,sweet,dessert,West Bengal,East,"To prepare Balu Shahi, start by combining 2 cups of maida with a pinch of baking soda. Add 1/4 cup of ghee and rub the mixture until it resembles breadcrumbs. Gradually incorporate 1/2 cup of yogurt, kneading into a smooth dough. Let it rest for 2 hours. Shape small portions of the dough into balls, then flatten and shape the edges. Fry in oil until golden brown. In a separate pan, make a sugar syrup with 1 cup of sugar and 1/4 cup of water, reaching a one-string consistency. Dip the fried Balu Shahi into the warm syrup, ensuring they are coated, and garnish with nuts if desired. Allow them to cool before serving."
Boondi,"Gram flour, ghee, sugar",vegetarian,80,30,sweet,dessert,Rajasthan,West,"To make Boondi, mix gram flour (besan) with water to form a smooth batter. Heat ghee in a pan, and using a slotted spoon, drop small droplets of the batter into hot ghee to create tiny, round boondi. Fry until they turn golden and crisp. In a separate pan, prepare a sugar syrup by dissolving sugar in water, creating a thick consistency. Once the boondi is ready, toss it into the warm sugar syrup, ensuring an even coating. Allow the boondi to absorb the syrup, and then let it cool."
Gajar ka halwa,"Carrots, milk, sugar, ghee, cashews, raisins",vegetarian,15,60,sweet,dessert,Punjab,North,"To prepare Gajar ka Halwa, start by grating fresh carrots. In a pan, heat ghee and sauté the grated carrots until they are tender and release their aroma. Add milk to the carrots and cook on low heat, stirring occasionally until the carrots absorb the milk and become soft. Once the mixture thickens, add sugar to sweeten the halwa. Continue cooking until the sugar is well incorporated. In a separate pan, lightly fry cashews and raisins in ghee until they are golden. Add these nuts and raisins to the carrot mixture, giving the halwa a delightful crunch. Stir well and cook until the halwa reaches a rich, creamy consistency. Gajar ka Halwa is ready to be served, offering a delicious blend of sweetened carrots and the richness of milk and nuts."
Ghevar,"Flour, ghee, kewra, milk, clarified butter, sugar, almonds, pistachio, saffron, green cardamom",vegetarian,15,30,sweet,dessert,Rajasthan,West,"To prepare Ghevar, begin by mixing flour with ghee and kewra-infused water to form a thick batter. Heat clarified butter (ghee) in a wide, deep pan. Pour a small amount of the batter into the hot ghee, creating a circular shape, and let it cook until it forms a porous and crispy structure. Remove the golden Ghevar and immerse it in a saffron and green cardamom-flavored sugar syrup, allowing it to soak up the sweetness. Garnish the Ghevar with slivered almonds and pistachios for added texture and flavor. The result is a delightful Rajasthani dessert, featuring a crispy and syrup-soaked delicacy adorned with the richness of nuts and aromatic spices."
Gulab jamun,"Milk powder, plain flour, baking powder, ghee, milk, sugar, water, rose water",vegetarian,15,40,sweet,dessert,West Bengal,East,"To make Gulab Jamun, combine milk powder, plain flour, and baking powder in a bowl. Add ghee and milk, kneading the mixture into a soft dough. Shape small, smooth balls from the dough. In a separate pan, prepare a sugar syrup by dissolving sugar in water and adding a few drops of rose water for fragrance. Heat the syrup until it reaches a slightly sticky consistency. Deep-fry the dough balls in ghee until golden brown, then soak them in the warm sugar syrup. Allow the Gulab Jamuns to absorb the syrup, making them soft and sweet. These delectable treats are then ready to be enjoyed, offering a perfect blend of rich, milky flavor and floral sweetness."
Imarti,"Sugar syrup, lentil flour",vegetarian,10,50,sweet,dessert,West Bengal,East,"To create Imarti, start by preparing a sugar syrup with water, sugar, and a touch of saffron for color and flavor. Boil the syrup until it reaches a one-string consistency. In a separate bowl, mix lentil flour with water to form a smooth batter. Fill a piping bag with the batter and pipe concentric circles into hot oil, forming spiral shapes. Fry until they turn golden and crisp. Once fried, immerse the Imartis in the warm saffron-infused sugar syrup, allowing them to soak up the sweetness. The result is a delightful Indian sweet with intricate patterns, a crispy texture, and a syrupy sweetness that makes Imarti a beloved treat."
Jalebi,"Maida, corn flour, baking soda, vinegar, curd, water, turmeric, saffron, cardamom",vegetarian,10,50,sweet,dessert,Uttar Pradesh,North,"To prepare Jalebi, start by combining maida (all-purpose flour) and corn flour in a bowl. Add baking soda, a splash of vinegar, and curd, and mix well. Gradually add water to form a smooth, lump-free batter. Allow the batter to ferment for a few hours or overnight, enhancing its flavor. When ready to cook, add turmeric or saffron for color and cardamom for aroma to the batter. Fill a piping bag with the mixture and pipe swirls into hot oil, frying until they become crisp and golden. Once fried, soak the Jalebis in a sugar syrup until they absorb the sweetness. The result is a popular Indian sweet characterized by its coiled shape, vibrant color, and sweet, aromatic taste."
Kaju katli,"Cashews, ghee, cardamom, sugar",vegetarian,10,20,sweet,dessert,unknown,unknown,"To make Kaju Katli, start by grinding cashews into a fine powder. In a pan, melt a small amount of ghee and add the cashew powder. Stir and cook on low heat until it forms a smooth, lump-free mixture. In a separate pan, prepare a sugar syrup by dissolving sugar in water. Add the sugar syrup to the cashew mixture and continue to cook, stirring continuously, until it thickens and leaves the sides of the pan. Add crushed cardamom for flavor and aroma. Once the mixture reaches a dough-like consistency, transfer it to a greased plate and flatten it into a thin layer. Allow it to cool, then cut it into diamond-shaped pieces. Kaju Katli is a delicious and iconic Indian sweet with a rich cashew flavor and a hint of cardamom."
Kalakand,"Milk, cottage cheese, sugar",vegetarian,20,30,sweet,dessert,West Bengal,East,"To prepare Kalakand, start by bringing milk to a boil in a wide, heavy-bottomed pan. Add cottage cheese (paneer) to the boiling milk and stir continuously to avoid lumps. Cook the mixture on medium heat until it thickens and most of the moisture evaporates. Add sugar to the mixture and continue stirring. As the mixture thickens further, it will start leaving the sides of the pan. At this point, transfer the mixture to a greased plate and spread it evenly. Allow it to cool and set. Once set, cut the Kalakand into squares or desired shapes. This Indian sweet is known for its grainy texture and rich milky taste, making it a delightful treat for celebrations and festivals."
Kheer,"Milk, rice, sugar, dried fruits",vegetarian,10,40,sweet,dessert,unknown,unknown,"To prepare Kheer, start by washing rice and soaking it for about 30 minutes. In a pot, bring milk to a boil and then add the soaked rice. Simmer on low heat, stirring occasionally to prevent sticking, until the rice is fully cooked and the mixture thickens. Add sugar and continue to simmer until the sugar dissolves and the kheer reaches a creamy consistency. Optionally, add dried fruits such as raisins, chopped almonds, and cashews for added texture and flavor. Stir well and let the kheer cool before serving. This traditional Indian rice pudding is a comforting and delicious dessert, often enjoyed during festivals and special occasions."
Laddu,"Gram flour, ghee, sugar",vegetarian,10,40,sweet,dessert,unknown,unknown,"To make Laddu, begin by roasting gram flour (besan) in ghee over medium heat until it turns golden brown and releases a nutty aroma. Once roasted, remove it from heat and let it cool slightly. Add sugar to the roasted gram flour and mix well. Allow the mixture to cool to a temperature where it can be comfortably handled. With greased hands, shape the mixture into round balls, forming laddus. Ensure the laddus hold their shape and have a smooth texture. These sweet gram flour laddus are a popular and simple Indian dessert, enjoyed during festivals and celebrations."
Lassi,"Yogurt, milk, nuts, sugar",vegetarian,5,5,sweet,dessert,Punjab,North,"To prepare Lassi, blend together yogurt and milk in a blender until smooth. Add sugar to the mixture and blend again until the sugar is fully dissolved. Optionally, you can include nuts like almonds or pistachios for added flavor and texture. Pour the lassi into glasses and serve chilled. Lassi is a refreshing and popular traditional Indian beverage, enjoyed for its cool and creamy consistency, making it a perfect drink to accompany meals or to beat the heat on a warm day."
Nankhatai,"Refined flour, besan, ghee, powdered sugar, yoghurt, green cardamom",vegetarian,20,30,sweet,dessert,unknown,unknown,"To make Nankhatai, start by preheating your oven. In a mixing bowl, combine refined flour, besan (gram flour), and ghee. Mix well until the ingredients are combined and resemble a crumbly texture. Add powdered sugar and yogurt to the mixture. Crush green cardamom and add it to the dough for flavor. Knead the ingredients together to form a smooth dough. Divide the dough into small portions and shape them into round cookies or discs. Place them on a baking tray and bake in the preheated oven until they turn golden brown. Allow the Nankhatais to cool before serving. These eggless shortbread-like cookies are a popular and delicious treat in Indian cuisine."
Petha,"Firm white pumpkin, sugar, kitchen lime, alum powder",vegetarian,10,30,sweet,dessert,Uttar Pradesh,North,"To craft Petha, a renowned North Indian sweet, begin by peeling and deseeding firm white pumpkin, cutting it into shapes like cubes or rectangles. Soak the pumpkin pieces in a solution of water and alum powder, allowing them to firm up. Afterward, rinse thoroughly to remove excess alum. In a separate pot, prepare a sugar syrup by dissolving sugar in water and adding a piece of kitchen lime to maintain the pumpkin's white color. Boil the syrup until it reaches a one-string consistency, then introduce the soaked pumpkin, cooking until it becomes translucent and the syrup thickens. Let the Petha cool and set in the sugar syrup before cutting it into shapes. The result is a delightful sweet, celebrated for its translucent appearance and mild sweetness."
Phirni,"Rice, sugar, nuts",vegetarian,30,20,sweet,dessert,Odisha,East,"To prepare Phirni, start by soaking rice in water for a few hours. Drain the soaked rice and grind it into a smooth paste. In a saucepan, heat milk and bring it to a boil. Add the ground rice paste to the boiling milk, stirring continuously to avoid lumps. Cook the mixture on low heat until the rice is fully cooked, and the mixture thickens to a creamy consistency. Add sugar and continue to stir until it dissolves completely. Optionally, you can include a variety of nuts such as almonds, pistachios, or cashews for added texture and flavor. Pour the Phirni into individual serving bowls and let it cool. Once chilled, garnish with more nuts before serving. Phirni is a delightful rice pudding, enjoyed as a cool and creamy dessert in Indian cuisine."
Rabri,"Condensed milk, sugar, spices, nuts",vegetarian,10,45,sweet,dessert,Uttar Pradesh,North,"To prepare Rabri, start by heating condensed milk in a thick-bottomed pan. Add sugar to the condensed milk and stir continuously on low heat until the mixture thickens. As the Rabri simmers, the milk reduces and becomes rich and creamy. Enhance the flavor with spices like cardamom for an aromatic touch. Include a variety of nuts such as almonds, pistachios, or cashews for added texture and crunch. Once the Rabri reaches a desired consistency and the flavors meld together, let it cool. Serve chilled, and enjoy this decadent Indian dessert that boasts a luscious, thickened milk base complemented by the warmth of spices and the richness of nuts."
Sheera,"Semolina, ghee, nuts, milk",vegetarian,10,25,sweet,dessert,Maharashtra,West,"To prepare Sheera, start by roasting semolina (sooji) in ghee until it turns golden and releases a nutty aroma. In a separate pan, heat milk. Slowly add the hot milk to the roasted semolina, stirring continuously to avoid lumps. Cook the mixture on low heat until the semolina absorbs the milk and reaches a smooth, pudding-like consistency. Add sugar to sweeten the Sheera and continue to stir until the sugar dissolves completely. Optionally, you can include nuts such as cashews and almonds for added richness and texture. Once the Sheera thickens and achieves the desired consistency, remove it from heat. Serve warm, and savor the comforting and sweet flavor of this classic Indian dessert."
Singori,"Khoa, coconut, molu leaf",vegetarian,10,20,sweet,dessert,Uttarakhand,North,"Singori is a traditional sweet from the Kumaon region of Uttarakhand, India. It is made by wrapping a mixture of khoa (reduced solidified milk) and grated coconut in molu leaves, also known as Maalu or Bauhinia leaves. The khoa and coconut filling is sweetened and then enclosed in the leaves, forming a cylindrical shape. These filled leaves are then tied with a string and typically steamed or roasted. The molu leaves impart a unique aroma and flavor to the sweet, giving Singori its distinctive taste. It is not only a delicious treat but also reflects the local culinary heritage of the Kumaon region."
Sohan halwa,"Corn flour, ghee, dry fruits",vegetarian,10,60,sweet,dessert,Uttar Pradesh,North,"Sohan Halwa is a delectable Indian sweet made with corn flour, ghee, and dry fruits. To prepare this indulgent delicacy, corn flour is roasted in ghee until it turns golden brown, creating a rich and nutty base. The mixture is then sweetened with sugar, and an array of dry fruits such as almonds, pistachios, and cashews are added to enhance the texture and flavor. The concoction is stirred continuously to achieve a smooth consistency before being poured into a greased tray and left to set. Once cooled and solidified, Sohan Halwa is cut into pieces, offering a delightful combination of sweet, nutty, and buttery goodness in every bite."
Sohan papdi,"Gram flour, ghee, sugar, milk, cardamom",vegetarian,0,60,sweet,dessert,Maharashtra,West,"To make Sohan Papdi, begin by preparing a sugar syrup. Boil sugar and water until it reaches a one-string consistency. In a separate pan, heat ghee, and add gram flour (besan). Roast the gram flour in ghee until it becomes aromatic and golden brown. Slowly incorporate the sugar syrup into the roasted gram flour while stirring continuously to avoid lumps. Add warm milk to the mixture, stirring vigorously to achieve a smooth consistency. Finally, mix in cardamom powder for fragrance. Spread this mixture onto a greased surface, flatten it, and let it cool. Once set, cut the Sohan Papdi into square or diamond shapes. This traditional Indian sweet boasts a delightful combination of the rich flavors of gram flour, ghee, and cardamom, making it a popular treat during festivals and celebrations."
Chhena jalebi,"Chhena, sugar, ghee",vegetarian,10,50,sweet,dessert,Odisha,East,"Chhena Jalebi is a delightful Bengali sweet made with chhena (fresh paneer or cottage cheese), sugar, and ghee. To prepare this delicacy, fresh chhena is kneaded into a smooth dough and shaped into small, spiral-like jalebis. These chhena spirals are then deep-fried until they achieve a golden brown hue. In a separate pan, a sugar syrup is prepared by dissolving sugar in water. The freshly fried chhena jalebis are then immersed in the warm sugar syrup, allowing them to absorb the sweetness. A touch of ghee may be added for a rich flavor. The result is a unique and syrup-soaked variation of the traditional jalebi, showcasing the distinct texture and taste of chhena."
Chhena kheeri,"Chhena, sugar, milk",vegetarian,0,60,sweet,dessert,Odisha,East,"Chhena Kheeri is a delightful Bengali dessert made with chhena (fresh paneer or cottage cheese), sugar, and milk. To prepare this sweet dish, crumbled or grated chhena is gently cooked in a pan along with milk until it thickens and achieves a creamy consistency. Sugar is added to sweeten the mixture, and the kheeri is simmered until the chhena is well-incorporated, creating a smooth and luscious texture. The result is a rich and flavorful dessert that beautifully combines the subtle sweetness of chhena with the creamy goodness of milk, making Chhena Kheeri a popular and comforting treat in Bengali cuisine."
Chhena poda,"Sugar, chenna cheese",vegetarian,10,45,sweet,dessert,Odisha,East,"Chhena Poda is a traditional Odia dessert made primarily with two ingredients: sugar and chhena cheese. To prepare this delightful sweet, fresh chhena (paneer or cottage cheese) is mixed with sugar to sweeten the mixture. The sweetened chhena is then flavored and sometimes spiced with cardamom or nutmeg for added aroma. The mixture is spread in a thin layer in a greased pan and traditionally baked in an earthen oven, giving it a unique smoky flavor. The result is a caramelized, slightly crusty exterior with a soft and sweet interior. Chhena Poda is a popular and flavorful dessert enjoyed in Odisha, India."
Cham cham,"Flour, cream, sugar, saffron, lemon juice, coconut flakes",vegetarian,40,60,sweet,dessert,West Bengal,East,"Cham Cham is a delectable Bengali sweet made from a combination of flour, cream, sugar, saffron, lemon juice, and coconut flakes. To prepare Cham Cham, a dough is made by kneading flour and cream together until a smooth consistency is achieved. The dough is then shaped into cylindrical or oval pieces and cooked in a sugar syrup until they become spongy and absorb the sweetness. Saffron is often added to the syrup for flavor and color, and lemon juice may be used to enhance the texture. Finally, the Cham Chams are rolled in coconut flakes, providing a delightful contrast to the soft and syrup-soaked interior. This sweet is a popular choice for celebrations and special occasions in Bengali cuisine."
Ledikeni,"Chhena, sugar, ghee",vegetarian,45,45,sweet,dessert,West Bengal,East,"Ledikeni is a classic Bengali sweet made with chhena (fresh paneer or cottage cheese), sugar, and ghee. To prepare Ledikeni, fresh chhena is kneaded into a smooth dough, shaped into elongated ovals, and deep-fried until they achieve a golden brown color. The fried chhena dumplings are then soaked in a sugar syrup, imparting sweetness and moisture to the dessert. Ghee may be used in the frying process for added richness. Ledikeni is known for its delectable taste and unique elongated shape, making it a cherished sweet in Bengali cuisine, especially during festive occasions and celebrations."
Lyangcha,"Flour, fried milk power, sugar syrup",vegetarian,20,30,sweet,dessert,Assam,North East,"Lyangcha is a traditional Bengali sweet made with a mixture of flour and fried milk powder, sweetened with sugar syrup. To prepare Lyangcha, a dough is made by combining flour and fried milk powder, creating a smooth and pliable consistency. The dough is then shaped into cylindrical or elongated forms. These shapes are deep-fried until they achieve a golden brown color and a crisp texture. After frying, Lyangchas are soaked in a sugar syrup, allowing them to absorb the sweetness and develop a syrupy exterior. The result is a delightful Bengali sweet that combines the richness of fried milk powder with the sweetness of sugar syrup, making it a popular treat during festive occasions."
Malapua,"Yoghurt, refined flour, ghee, fennel seeds",vegetarian,10,120,sweet,dessert,Bihar,North,"Malpua is a traditional Indian sweet pancake that is often enjoyed during festivals and special occasions. To make Malpua, a batter is prepared by combining yogurt and refined flour, creating a smooth consistency. The batter is then flavored with fennel seeds for a hint of aromatic warmth. Small portions of this batter are ladled into hot ghee and fried until they become golden brown and crispy. Once fried, Malpuas are often soaked in sugar syrup to enhance their sweetness and moisture. This delightful sweet is known for its unique combination of textures—crispy on the edges and soft in the center—making it a favorite indulgence in Indian cuisine."
Mihidana,"Besan flour, sugar, ghee",vegetarian,15,30,sweet,dessert,West Bengal,East,"Mihidana is a traditional Bengali sweet that is crafted with just three primary ingredients: besan flour (gram flour), sugar, and ghee. To prepare Mihidana, besan is mixed with water to form a smooth, thick batter. Small droplets of this batter are then carefully dropped into hot ghee, resulting in tiny, bead-like formations. These besan beads are fried until they achieve a golden hue and a crispy texture. After frying, they are coated in a sugar syrup, allowing them to absorb the sweetness and develop a glossy exterior. Mihidana is celebrated for its unique appearance and the delightful combination of the nutty besan flavor with the sweet syrup, making it a popular choice during festivals and special occasions in Bengali cuisine."
Misti doi,"Milk, jaggery",vegetarian,480,30,sweet,dessert,West Bengal,East,"Misti Doi, also known as ""sweet yogurt,"" is a popular Bengali dessert made with just two main ingredients: milk and jaggery. To prepare Misti Doi, milk is boiled and then allowed to cool to a lukewarm temperature. Jaggery, a natural sweetener, is added to the milk and mixed until it dissolves completely. The sweetened milk is then transferred to earthen pots and left to set, allowing the natural fermentation process to occur. This results in Misti Doi's distinct thick and creamy texture with a delicate caramel-like sweetness from the jaggery. Served chilled, Misti Doi is a cherished dessert in Bengali cuisine, appreciated for its unique flavor and smooth consistency."
Pantua,"Chhena, sugar, ghee, flour",vegetarian,45,45,sweet,dessert,West Bengal,East,"Pantua is a delectable Bengali sweet made from a combination of chhena (fresh paneer or cottage cheese), sugar, ghee, and flour. To prepare Pantua, fresh chhena is kneaded into a smooth dough and mixed with a small amount of flour. This dough is then shaped into round balls and deep-fried until they achieve a golden brown color. The fried chhena balls are soaked in a sugar syrup, allowing them to absorb the sweetness and become moist. Ghee may be used in the frying process, adding richness to the flavor. Pantua is similar to Gulab Jamun but has its unique taste and texture, making it a favorite sweet during festivals and celebrations in Bengal."
Pithe,"Rice flour, wheat flour",vegetarian,15,35,sweet,dessert,Assam,North East,"Pithe refers to a traditional Bengali sweet that comes in various forms, typically made during winter festivals like Makar Sankranti. The key ingredients for many types of Pithe include rice flour and wheat flour. To prepare, a dough is made by combining rice flour and wheat flour with water, creating a smooth and pliable consistency. This dough is then shaped into different forms, such as flatbreads or dumplings, and filled with sweetened ingredients like jaggery, coconut, khoya (reduced milk), or sesame seeds. The filled dough is often cooked by methods like frying, steaming, or baking, resulting in a variety of Pithe with diverse textures and flavors. These sweets hold cultural significance and are enjoyed as a part of festive traditions in Bengali households."
Rasabali,"Chenna, sweetened milk",vegetarian,15,30,sweet,dessert,Odisha,East,"Rasabali is a traditional Odia sweet that features chenna (fresh paneer or cottage cheese) and sweetened milk. To prepare Rasabali, chenna is shaped into flat discs and deep-fried until they turn golden brown. These fried chenna discs are then soaked in sweetened milk, which is often flavored with cardamom. The chenna absorbs the sweetness and aromatic essence of the milk, resulting in a delightful dessert with a unique texture. Rasabali is enjoyed for its rich and creamy taste, making it a popular sweet during festivals and special occasions in Odisha, India."
Ras malai,"Chhena, reduced milk, pistachio",vegetarian,180,60,sweet,dessert,West Bengal,East,"Ras Malai is a luscious Indian dessert made with chhena (fresh paneer or cottage cheese), reduced milk, and pistachios. To prepare Ras Malai, chhena is kneaded into a soft dough, shaped into flattened balls, and gently cooked in a simmering mixture of milk and sugar until they become spongy and absorb the sweetness. The cooked chhena balls are then immersed in thickened, reduced milk, often flavored with cardamom or saffron, enhancing the overall richness and aroma. The dessert is garnished with chopped pistachios, adding a delightful crunch and nutty flavor. Ras Malai is enjoyed chilled, making it a beloved treat during festive occasions and celebrations in Indian cuisine."
Rasgulla,"Chhena, sugar, cardamom",vegetarian,10,90,sweet,dessert,West Bengal,East,"Rasgulla is a popular Indian sweet made primarily with chhena (fresh paneer or cottage cheese), sugar, and cardamom. To prepare Rasgulla, chhena is kneaded into a smooth dough and shaped into small, round balls. These chhena balls are then cooked in a sugar syrup flavored with cardamom until they become spongy and absorb the sweetness. The cardamom adds a fragrant and aromatic element to the syrup. Rasgullas are known for their soft and spongy texture, and they are often served chilled. This classic dessert is widely enjoyed across India and is a favorite during festivals and celebrations."
