name,ingredients,diet,prep_time,cook_time,flavor_profile,course,state,region,instructions
Bajri no rotlo,"Wheat flour, pearl millet flour, hot water",vegetarian,10,10,spicy,main course,Gujarat,West,"Bajri no Rotlo is a traditional and wholesome flatbread from the Indian state of Gujarat. To prepare this dish, a mixture of wheat flour and pearl millet flour (bajra flour) is combined, and hot water is added to form a dough. The dough is then divided into portions, and each portion is hand-pressed or patted into round, flat discs. These discs are typically thicker than regular wheat rotis. The use of pearl millet flour adds a nutty flavor and nutritional richness to the rotlo. The flatbreads are cooked on a hot griddle or open flame until they develop a golden brown color. Bajri no Rotlo is often served with ghee (clarified butter), yogurt, or a variety of pickles, offering a simple and nutritious staple in Gujarati cuisine."
Coconut vadi,"Condensed milk, mawa, desiccated coconut, almonds, cashews",vegetarian,20,30,sweet,dessert,Maharashtra,West,"Coconut Vadi is a delectable Indian sweet that combines the richness of condensed milk and mawa (khoya) with the delightful texture of desiccated coconut, almonds, and cashews. To prepare, condensed milk and mawa are cooked together until they form a thick, fudgy consistency. Desiccated coconut is then added to the mixture, providing a chewy and coconutty element. Chopped almonds and cashews contribute a crunchy texture and nutty flavor. The combined mixture is shaped into small, bite-sized pieces and allowed to cool, resulting in irresistible Coconut Vadi. This sweet treat is a popular choice during festivals and celebrations, showcasing the luscious combination of dairy, coconut, and nuts in Indian sweets."
Bombil fry,"Bombay duck, malvani masala, rice flour, bombay rava, green chilies",non vegetarian,-1,-1,spicy,main course,Maharashtra,West,"Bombil Fry, a popular seafood dish, features Bombay duck, also known as bombil, as the main ingredient. To prepare, the Bombay duck is coated with a mixture of Malvani masala (a flavorful spice blend from the Malvan region), rice flour, Bombay rava (semolina), and green chilies. This coating provides a crisp and flavorful exterior when the fish is fried. The marinated Bombay duck is then deep-fried until it achieves a golden-brown and crispy texture. Bombil Fry is a beloved dish along the coastal regions of Maharashtra and is often served as a delicious appetizer or side dish, showcasing the unique flavors of Malvani cuisine and the versatility of seafood in Indian culinary traditions."
Chakali,"Rice flour, sesame, plain flour, turmeric, red chilli",vegetarian,10,40,spicy,snack,Maharashtra,West,"Chakali is a popular Indian snack known for its spiral shape and crunchy texture. To prepare chakali, a mixture of rice flour, plain flour, and spices like turmeric and red chili are combined to create a dough. This dough is then shaped into spirals using a chakali press or a mold. Sesame seeds are often added to the dough for an extra crunch and nutty flavor. The formed chakalis are deep-fried until they turn golden brown and crispy. This savory and spiced snack is enjoyed during festive occasions or as a tea-time treat. Chakali showcases the diverse range of snacks in Indian cuisine, with its unique shape and delightful combination of flavors."
Chevdo,"Citric acid, fry, raisins, sugar, chana daal",vegetarian,20,30,spicy,snack,Gujarat,West,"Chevdo is a popular Indian snack mix that combines various ingredients to create a sweet, savory, and crunchy blend. To prepare chevdo, ingredients like chana dal (split chickpeas), raisins, and sugar are fried until they achieve a golden brown color. Citric acid is often added to impart a tangy flavor to the mix. The combination of sweet and tangy elements, along with the crunchiness of the fried ingredients, creates a delightful snack with a unique taste profile. Chevdo is enjoyed during festivals and special occasions in Indian households, showcasing the diverse flavors and textures found in traditional Indian snacks."
Dahi vada,"Urad dal, bhuna chana, garam masala, dates, tamarind",vegetarian,30,30,-1,snack,Maharashtra,West,"Dahi Vada is a popular Indian dish consisting of deep-fried lentil dumplings soaked in yogurt and topped with flavorful chutneys. To prepare the vadas, urad dal and bhuna chana (roasted gram) are ground into a batter, seasoned with garam masala, and then deep-fried until golden brown. The fried vadas are then soaked in water to remove excess oil and later immersed in whipped yogurt. The dish is garnished with a combination of sweet and tangy chutneys made from dates and tamarind. Dahi Vada is loved for its contrasting textures – the softness of the vadas against the creamy yogurt and the burst of flavors from the chutneys, making it a popular and refreshing snack in Indian cuisine."
Dalithoy,"Arhar dal, coconut oil, curry leaves, mustard seeds, red chilli",vegetarian,5,20,-1,main course,Maharashtra,West,"Dalithoy is a traditional South Indian dal preparation that highlights the simplicity and flavors of lentils. Arhar dal (pigeon pea lentils) is cooked until soft and then seasoned with a tempering of mustard seeds, red chili, and curry leaves in coconut oil. This tempering, also known as tadka, adds a burst of aromatic and savory notes to the dal. Dalithoy is appreciated for its mild and comforting taste, often served with rice or Indian bread. The use of coconut oil and curry leaves in the tempering provides a distinctive South Indian touch, enhancing the overall appeal of this classic dal dish."
Dhokla,"Rava, coconut, gram flour, mustard, sesame",vegetarian,10,20,spicy,snack,Gujarat,West,"Dhokla is a popular and steamed savory cake in Indian cuisine, particularly associated with the western state of Gujarat. To prepare dhokla, a batter is made by combining gram flour (besan) with rava (semolina), coconut, and various spices. This batter is fermented for a few hours to achieve a light and airy texture. The mixture is then seasoned with a tempering of mustard seeds and sesame seeds, adding a burst of flavor. The batter is steamed until it rises and sets into a spongy cake. Once cooked, it is cut into squares or diamond shapes. Dhokla is often served with green chutney and a sprinkling of grated coconut, offering a delightful combination of textures and flavors in a popular Indian snack or breakfast item."
Dudhi halwa,"Bottle gourd, green, raisins, sugar, clarified butter",vegetarian,15,30,sweet,dessert,Gujarat,West,"Dudhi Halwa is a sweet and delectable Indian dessert made from bottle gourd (dudhi or lauki). To prepare, grated bottle gourd is cooked in clarified butter (ghee) until it softens and releases its moisture. Sugar is then added to sweeten the mixture, and the halwa is stirred continuously until it thickens and attains a rich, caramelized color. Raisins are often incorporated for added sweetness and texture. Dudhi Halwa is loved for its smooth and luscious consistency, making it a comforting and indulgent treat. This dessert is frequently enjoyed during festivals and special occasions in Indian households, showcasing the versatility of humble ingredients in creating delightful sweets."
Gatta curry,"Yogurt, besan, sauce, garam masala powder, gram flour",vegetarian,10,20,spicy,main course,Rajasthan,West,"Gatta Curry is a popular Rajasthani dish known for its flavorful yogurt-based curry and dumplings made from gram flour (besan). To prepare the gatta (dumplings), besan is mixed with spices and shaped into cylindrical pieces, which are then boiled until cooked through. These gatta are sliced and added to a rich curry made from yogurt and a blend of spices, including garam masala powder. The curry is simmered until it achieves a creamy consistency, allowing the flavors to meld together. Gatta Curry is often enjoyed with rice or Indian bread, and the combination of the soft dumplings with the tangy and spiced yogurt curry creates a satisfying and hearty dish in Rajasthani cuisine."
Halvasan,"Whole wheat rava, chia seed, lemon, edible gum, litre milk",vegetarian,-1,-1,sweet,dessert,Gujarat,West,"Halvasan is a traditional Indian sweet with a unique blend of ingredients. To prepare this dessert, whole wheat rava (semolina) is roasted until golden brown. Chia seeds, lemon juice, and edible gum are added to the mix, creating a distinct texture and flavor profile. A liter of milk is then used to form a thick and sweetened mixture. The combined ingredients are cooked until the mixture thickens and attains a halwa-like consistency. Halvasan is often shaped into squares or diamonds and allowed to cool before serving. This sweet treat showcases the use of wholesome ingredients and the skillful combination of flavors to create a delightful and traditional Indian dessert."
Jeera Aloo,"Green chilies, lemon juice, chili powder, boiled potatoes",vegetarian,10,30,spicy,main course,Gujarat,West,"Jeera Aloo is a simple yet flavorful Indian dish featuring boiled potatoes seasoned with cumin (jeera), green chilies, lemon juice, and chili powder. To prepare, boiled potatoes are diced or sliced and then sautéed in a pan with cumin seeds until they become golden and crispy. Green chilies add a spicy kick, while lemon juice imparts a tangy freshness. Chili powder contributes to the dish's vibrant color and enhances its spiciness. This quick and delicious side dish is often enjoyed with Indian bread, rice, or as a standalone snack, showcasing the versatility of potatoes and the aromatic blend of spices in Indian cuisine."
Laapsi,"Cinnamon, jaggery, clarified butter, dry roasted",vegetarian,10,40,spicy,main course,Madhya Pradesh,Central,"Laapsi is a traditional Indian sweet dish made from cracked wheat (dalia) or lapsi, which is dry roasted until it attains a golden color. To prepare, clarified butter (ghee) is heated in a pan, and dry roasted lapsi is added, along with cinnamon for flavor. The mixture is stirred continuously to ensure even roasting. Once the lapsi is well-roasted, jaggery is added to sweeten the dish. The jaggery melts and blends with the lapsi, creating a sweet and aromatic mixture. Laapsi is often garnished with nuts like almonds or cashews for added texture and richness. This delightful sweet dish is enjoyed during festivals and special occasions in various regions of India."
Methi na Gota,"Rava, gram flour, lemon juice, turmeric, fenugreek leaves",vegetarian,15,30,bitter,main course,Gujarat,West,"Methi na Gota is a popular Gujarati snack that features fenugreek leaves as a key ingredient. To prepare, a batter is made by combining gram flour (besan) with semolina (rava), and fenugreek leaves are added to create a flavorful mixture. The batter is seasoned with turmeric and lemon juice for added brightness. Small fritters are then formed by dropping spoonfuls of the mixture into hot oil and frying until they turn golden brown and crispy. Methi na Gota is enjoyed for its unique combination of textures and the distinctive taste of fenugreek. It is often served with chutney or as part of a snack platter, showcasing the flavors of Gujarati cuisine."
Mohanthal,"Rose water, pistachio, badam, bengal gram flour, saffron",vegetarian,5,45,sweet,dessert,Gujarat,West,"Mohanthal is a traditional Indian sweet, hailing from the state of Gujarat, known for its rich and nutty flavor. To prepare Mohanthal, Bengal gram flour (besan) is roasted until it achieves a golden color, and then ghee is added to form a thick, sweetened mixture. This mixture is infused with the essence of rose water and saffron, contributing to its aromatic profile. Chopped pistachios and almonds (badam) are added for crunch and additional richness. The sweet is then set in a tray, cut into diamond-shaped pieces, and garnished with more nuts. Mohanthal is a popular choice during festivals and celebrations, showcasing the indulgent and festive spirit of Indian sweets."
Vindaloo,"Chicken, coconut oil, wine vinegar, ginger, green, cinnamon",non vegetarian,10,40,spicy,main course,Goa,West,"Vindaloo is a flavorful and spicy Indian curry, often associated with Goan cuisine. To prepare Chicken Vindaloo, chicken pieces are marinated in a mixture of coconut oil, wine vinegar, and a blend of spices such as ginger, green chilies, and cinnamon. The marinade is left to infuse the chicken with its bold flavors. The dish is then slow-cooked until the chicken becomes tender and absorbs the rich and tangy essence of the spices. Vindaloo is renowned for its fiery taste and aromatic complexity, making it a popular and distinctive dish in Indian cuisine, particularly celebrated for its unique blend of Indian and Portuguese culinary influences."
Lilva Kachori,"Green garlic chutney, fresh green peas, ginger, lemon juice, plain flour",vegetarian,30,6,spicy,snack,Gujarat,West,"Lilva Kachori is a delightful Indian snack known for its crisp and flaky pastry filled with a flavorful mixture of fresh green peas (lilva), ginger, and spices. To prepare, a dough is made from plain flour and rolled into small rounds. The rounds are filled with a mixture of fresh green peas, ginger, lemon juice, and spices. The filled dough is then shaped into small pockets and deep-fried until golden brown and crispy. Lilva Kachori is often served with green garlic chutney for a zesty and aromatic accompaniment. This snack is a favorite during festive occasions and celebrations, showcasing the culinary richness of Indian street food."
Churma Ladoo,"Whole wheat flour, khus khus, sesame seeds, dry coconut, gur",vegetarian,12,40,sweet,dessert,Rajasthan,West,"Churma Ladoo is a traditional Indian sweet made from whole wheat flour, khus khus (poppy seeds), sesame seeds, dry coconut, and gur (jaggery). To prepare, whole wheat flour is roasted until it turns golden brown. It is then combined with roasted khus khus, sesame seeds, grated dry coconut, and crushed jaggery. The mixture is shaped into round ladoos or sweet balls. Churma Ladoo is known for its rich, nutty flavor and is often prepared during festivals and special occasions, offering a delicious and wholesome treat in Indian sweets."
Cheera Doi,"Rice, mango, curd",vegetarian,-1,-1,sweet,dessert,West Bengal,East,"Cheera Doi is a traditional Bengali dessert that features a delightful combination of rice, mango, and curd (yogurt). To prepare, rice is cooked and combined with mango pulp, creating a sweet and fruity mixture. This is then mixed with curd to achieve a creamy consistency. The dessert is typically sweetened with sugar or jaggery, and the flavors are allowed to meld together, creating a refreshing and indulgent treat. Cheera Doi is often enjoyed during festivals and celebrations in Bengal, showcasing the region's love for the harmonious blend of rice and dairy in their sweet dishes."
Gheela Pitha,"Sticky rice, rice flour, jaggery, orange rind",vegetarian,10,30,sweet,dessert,Assam,North East,"Gheela Pitha is a traditional Assamese sweet dish that incorporates sticky rice, rice flour, jaggery, and orange rind. To prepare, a mixture of sticky rice and rice flour is combined with jaggery to form a sweetened dough. The dough is then shaped into small, flat pancakes and pan-fried until they attain a golden-brown color. The inclusion of orange rind adds a citrusy aroma and flavor to the pithas, enhancing the overall taste. Gheela Pitha is often enjoyed during festivals and special occasions in Assam, representing the cultural richness and diversity of Assamese cuisine."
Black rice,"Forbidden black rice, chicken, olive oil, slivered almonds, garlic powder",non vegetarian,-1,-1,-1,main course,Manipur,North East,"Black rice is a nutritious and flavorful variety of rice, often referred to as Forbidden Black Rice. To prepare a dish with black rice and chicken, the rice is cooked separately until tender and set aside. In a pan, chicken is cooked with olive oil until it reaches a golden-brown color. Slivered almonds are added for a nutty crunch, and garlic powder contributes to the savory flavor profile. The cooked black rice is then combined with the seasoned chicken and almond mixture, creating a wholesome and visually striking dish. Forbidden Black Rice is celebrated for its distinct taste, nutty texture, and high nutritional value, making it a popular choice for creating unique and health-conscious meals."
Pakhala,"Curd, cooked rice, curry leaves, dry chilli",vegetarian,-1,-1,-1,main course,Odisha,East,"Pakhala is a traditional Odia dish that involves fermented rice soaked in water and served with curd. To prepare Pakhala, cooked rice is allowed to ferment in water, creating a slightly sour taste. The fermented rice is then mixed with curd, resulting in a cooling and refreshing dish. Curry leaves and dry chillies are often used for tempering to enhance the flavor. Pakhala is a popular choice, especially during hot summer days, as it is known for its hydrating and soothing qualities. This dish reflects the cultural significance of rice and curd in Odia cuisine, offering a simple yet delicious way to enjoy these staple ingredients."
Pani Pitha,"Tea leaves, white sesame seeds, dry coconut, soaked rice",vegetarian,10,20,-1,main course,Assam,North East,"Pani Pitha is a traditional Assamese delicacy prepared with tea leaves, white sesame seeds, dry coconut, and soaked rice. To make Pani Pitha, soaked rice is ground into a paste, and tea leaves are added to create a distinct flavor. White sesame seeds and dry coconut are incorporated into the mixture, creating a rich and aromatic blend. The batter is then shaped into small, flat discs and either pan-fried or steamed. Pani Pitha is often enjoyed during festivals and special occasions in Assam, showcasing the unique combination of ingredients and culinary traditions in Assamese cuisine."
Payokh,"Basmati rice, rose water, sugar, clarified butter, cardamom pods",vegetarian,-1,-1,sweet,dessert,Assam,North East,"Payokh is a traditional Kashmiri sweet dish made with basmati rice, rose water, sugar, clarified butter (ghee), and cardamom pods. To prepare Payokh, basmati rice is cooked and then combined with a sugar syrup infused with aromatic rose water and cardamom. The mixture is further enriched with the addition of clarified butter, creating a rich and flavorful dessert. Payokh is often garnished with nuts like almonds or pistachios, adding both texture and visual appeal to this delightful Kashmiri sweet. It is commonly enjoyed during festivals and celebrations, reflecting the cultural richness of Kashmiri cuisine."
Prawn malai curry,"Coconut milk, prawns, garlic, turmeric, sugar",non vegetarian,15,50,spicy,main course,West Bengal,East,"Prawn Malai Curry is a delectable Bengali dish made with prawns in a creamy coconut milk base. To prepare, prawns are cooked in a sauce made with coconut milk, garlic, turmeric, and a hint of sugar. The coconut milk lends richness and a subtle sweetness to the curry, while garlic and turmeric contribute aromatic flavors. Prawn Malai Curry is a harmonious blend of spices and creamy texture, making it a popular and flavorful seafood dish in Bengali cuisine."
Bebinca,"Coconut milk, egg yolks, clarified butter, all purpose flour",vegetarian,20,60,sweet,dessert,Goa,West,"Bebinca is a traditional Goan dessert made with coconut milk, egg yolks, clarified butter (ghee), and all-purpose flour. To prepare Bebinca, layers of batter are created by alternating between pouring and baking, resulting in a multi-layered cake. Each layer is cooked until golden brown before adding the next. The richness of coconut milk and clarified butter imparts a luxurious texture and flavor to the dessert. Bebinca is often enjoyed during special occasions and festive celebrations in Goa, showcasing the region's love for coconut-based sweets."
Shufta,"Cottage cheese, dry dates, dried rose petals, pistachio, badam",vegetarian,-1,-1,sweet,dessert,Jammu & Kashmir,North,"Shufta is a traditional Kashmiri sweet dish made with a rich assortment of ingredients. To prepare Shufta, cottage cheese is combined with dry dates, dried rose petals, pistachios, and almonds (badam). The mixture is then flavored with aromatic spices and sugar to enhance its sweetness. Shufta is a unique and flavorful dessert often associated with Kashmiri cuisine, showcasing the region's use of local ingredients and the art of creating rich, festive sweets. It is typically enjoyed during special occasions and celebrations in Kashmir."
Mawa Bati,"Milk powder, dry fruits, arrowroot powder, all purpose flour",vegetarian,20,45,sweet,dessert,Madhya Pradesh,Central,"Mawa Bati is a sweet dish made with milk powder, dry fruits, arrowroot powder, and all-purpose flour. To prepare, a mixture is created using milk powder, finely chopped dry fruits, and arrowroot powder. This mixture is then combined with all-purpose flour to form a dough. The dough is shaped into small rounds and deep-fried until golden brown. Mawa Bati is often enjoyed during festivals and special occasions, showcasing the richness of milk-based sweets in Indian cuisine."
